{
  "id": "65cb2bf0-d4c2-4886-8ad0-b76f1ba75d61",
  "instanceId": "cd28da0f-a3e4-465c-82f1-acade4e8e170",
  "permanentLocationId": "d9cd0bed-1b49-4b5e-a7bd-064b8d177231",
  "holdingsStatements": [
    {
      "statement": "Line 1",
      "note": "Note to line 1"
    },
    {
      "statement": "Line 2",
      "note": "Note to line2"
    }
  ],
  "tags" : {
    "tagList" : [
      "important"
    ]
  },
  "metadata" : {
    "createdDate" : "1970-01-01T00:00:00.000+00:00",
    "createdByUserId" : "b22b1169-5a4e-488d-a5f1-8900900dcoffe",
    "updatedDate" : "1995-05-23T14:27:46.245+00:00",
    "updatedByUserId" : "b22b1169-5a4e-488d-a5f1-8900900dcoffe"
  }
}
